{
  "framework_version": "0.10.0-candidate.2",
  "project_id": "SYNTHETIC-TASK-TOOL",
  "assignment_policy": "fixed",
  "hard_constraints": [],
  "preferences": [],
  "team": [
    {
      "member_id": "M1",
      "confirmed_responsibilities": [
        "implementation",
        "review",
        "frontend"
      ],
      "availability": "每周三天（合成输入）",
      "capabilities": [
        "CLI",
        "testing"
      ]
    },
    {
      "member_id": "M2",
      "confirmed_responsibilities": [
        "review"
      ],
      "availability": "每周一天（合成）",
      "capabilities": [
        "testing"
      ]
    }
  ],
  "suggested_changes": [],
  "unknowns": []
}
